{"adjudication":{"decisions":241,"review_scope":{"core_conflict":205,"supplement_low_confidence":36},"unit_type":{"candidate":133,"gold":85,"query":23}},"agreement":{"binary_pairs":560,"double_review_queries":24,"excluded_unresolved_pairs":0,"expected_agreement":0.8427487244897959,"kappa":0.7047491584539891,"observed_agreement":0.9535714285714286,"status":"complete"},"audit_id":"bright-label-quality-audit-v0.1","candidates":{"confidence":{"high":2697,"low":0,"medium":107},"decision_status":{"abstain":0,"decided":2804,"uncertain":0},"likely_hard_negative":{"no":2549,"uncertain":0,"yes":255},"relevance":{"not_relevant":2544,"relevant":260,"uncertain":0},"sensitive_information_risk":{"high":0,"low":25,"moderate":1,"none":2778,"uncertain":0},"suspected_missing_positive":{"credible":97,"not_applicable":291,"not_credible":2416,"uncertain":0}},"coverage":{"candidate_items":2804,"gold_items":1235,"queries":120,"tracks":{"economics":60,"psychology":60}},"gates":{"binary_candidate_relevance_kappa":{"comparison":"below","status":"pass","threshold":0.7,"value":0.7047491584539891},"credible_missing_positive_queries":{"comparison":"exceeds","denominator":120,"numerator":42,"status":"fail","threshold":0.1,"value":0.35},"unresolved_judgments":{"breakdown":{"adjudicated":1,"effective_final":1,"primary":0,"validator_core":0,"validator_supplement":0},"comparison":"exceeds","status":"fail_closed","threshold":0,"value":1},"unsupported_or_ambiguous_gold":{"comparison":"exceeds","denominator":1235,"numerator":1036,"status":"fail","threshold":0.05,"value":0.8388663967611336}},"gold":{"ambiguity":{"ambiguous":10,"unambiguous":1225,"uncertain":0},"confidence":{"high":1013,"low":0,"medium":222},"decision_status":{"abstain":0,"decided":1235,"uncertain":0},"support":{"does_not_support":744,"partially_supports":290,"supports":201,"uncertain":0}},"judgment_standard":"agent_label_audit_not_human_gold","official_qrels_modified":false,"outcome":"fail_closed","publication":{"classification":"research_only","export":"closed","leaderboard":"closed"},"queries":{"answerability":{"answerable":89,"no_answer":31,"uncertain":0},"confidence":{"high":95,"low":1,"medium":24},"credible_missing_positive":{"no":78,"uncertain":0,"yes":42},"decision_status":{"abstain":0,"decided":119,"uncertain":1},"label_incompleteness_risk":{"high":51,"low":48,"moderate":17,"none":4,"uncertain":0},"likely_hard_negative_present":{"no":40,"uncertain":0,"yes":80},"qrels_completeness":{"complete_enough":41,"incomplete":78,"uncertain":1},"sensitive_information_risk":{"high":0,"low":7,"moderate":1,"none":112,"uncertain":0}},"restricted_text_identifiers_rankings_paths_or_reviewer_identity_included":false,"schema_version":"1","source_identities":{"adjudication_decisions_sha256":"2be3f846b5ee6dc3e7efc11625f3fa813bb31312e14808a871715cab9a74db39","audit_pack_sha256":"9549525cbd35e0a3c520ad16b5961b3f5e8658ff7cb4b5061e9edd39bc96c956","double_review_selection_identity_sha256":"a3ea1bc99c5b16129ba4350a138894030d469ac70f51406c054f6d09cef33fba","double_review_selection_sha256":"054e76d8981bb8be497d2dd49bb7d4dbd8b2a1987e21a762658c95ad3b5f3eb0","frozen_input_manifest_sha256":"fbe3e00f97f158982108e7259fde46cecfe0187193a84a6fd6afcd2eecfd1b85","predeclaration_sha256":"bfe69d71fc5fa09109a6bb84819cef5c2c528767adc3a2dd8ff0211a3322081d","primary_annotations_sha256":"4f18deca204c8bcbfd269ecc216f130abbd6a5630a5c245870cfa55a341b0356","primary_input_sha256":"6767e3337b89cac41c8a13bb05044ee4690dd05c6511860f2faa674ad4b60686","review_plan_sha256":"93848a826c12acf9cb6fed50d71dd9490be7baebfcea1122dd4fffb4881fdc4e","rubric_sha256":"cadf239c93ab40e583e524bfe8364c655eaad1d8dde07bc57892fa0776dd22b9","validator_core_annotations_sha256":"bbe93a3af20f64d6d240a82b481fba7262fca2fbfa9369e966d5c802eb0318ff","validator_core_input_sha256":"1dc84c62238d955de30628e60545aa7acdfab4db6d92120ce916362ca34748de","validator_core_seal_sha256":"613a197bf183305157aadd68d4a5db3c5dda81d4e204bfce9009b0e556dbb11f","validator_supplement_annotations_sha256":"8e975641f0d083f972a71286f9782413c75557a5c85627bc35026e5d8940359f","validator_supplement_input_sha256":"94001e58f893a02a18fb6c3b3dbb1f65f12f231be004adedc1256fab225d6b64"}}
